<?xml version="1.0" encoding="UTF-8"?>
<!--
To change this license header, choose License Headers in Project Properties.
To change this template file, choose Tools | Templates
and open the template in the editor.
-->

<!DOCTYPE library SYSTEM "newemptyDTD.dtd">

<library location="Nasr city" description="$my_description;" librarian="Mnal">
    <books>
        <book title="meki" ISBN="1997" Author="radya">
            <preface>
                <![CDATA[
                        book' preface
                 ]]>
            </preface>
            <parts>
                <part title="" summary="">
                    <sections>
                        <section>
                            <content>
                                <paragraph/>
                            </content>
                        </section>
                    </sections>
                </part>
            </parts>
        </book>
    </books>
</library>
